{
  "$schema": "https://json-schema.org/draft/2020-12/schema",
  "$id": "urn:magic-glass-box:schema:work-item:v1",
  "title": "Magic Glass Box Work Item v1",
  "description": "Forge-neutral, untrusted assignment content for atomic import.",
  "type": "object",
  "additionalProperties": false,
  "required": [
    "schema_version",
    "source",
    "external_id",
    "source_updated_at",
    "title",
    "brief"
  ],
  "properties": {
    "schema_version": {
      "const": 1
    },
    "source": {
      "type": "string",
      "pattern": "^[a-z][a-z0-9_.-]{0,63}$"
    },
    "external_id": {
      "type": "string",
      "minLength": 1,
      "maxLength": 512
    },
    "source_updated_at": {
      "type": "string",
      "format": "date-time",
      "maxLength": 64
    },
    "title": {
      "type": "string",
      "minLength": 1,
      "maxLength": 512
    },
    "brief": {
      "type": "string",
      "minLength": 1,
      "maxLength": 65536
    },
    "acceptance_criteria": {
      "type": "array",
      "maxItems": 128,
      "uniqueItems": true,
      "items": {
        "type": "string",
        "minLength": 1,
        "maxLength": 4096
      },
      "default": []
    },
    "constraints": {
      "type": "array",
      "maxItems": 128,
      "uniqueItems": true,
      "items": {
        "type": "string",
        "minLength": 1,
        "maxLength": 4096
      },
      "default": []
    },
    "context": {
      "type": "array",
      "maxItems": 128,
      "uniqueItems": true,
      "items": {
        "oneOf": [
          {
            "type": "object",
            "additionalProperties": false,
            "required": ["type", "value"],
            "properties": {
              "type": { "const": "note" },
              "value": {
                "type": "string",
                "minLength": 1,
                "maxLength": 8192
              }
            }
          },
          {
            "type": "object",
            "additionalProperties": false,
            "required": ["type", "value"],
            "properties": {
              "type": { "const": "workspace_path" },
              "value": {
                "type": "string",
                "minLength": 1,
                "maxLength": 1024
              }
            }
          }
        ]
      },
      "default": []
    },
    "labels": {
      "type": "array",
      "maxItems": 64,
      "uniqueItems": true,
      "items": {
        "type": "string",
        "minLength": 1,
        "maxLength": 128
      },
      "default": []
    },
    "priority": {
      "enum": ["low", "normal", "high", "urgent"],
      "default": "normal"
    }
  }
}
